Keywords,Utterance,Response
"hello, hi, greet","hello, hi, hey, greetings",Hello! I am your health assistant. How can I help you today?
"head, pain, ache","i have a headache, my head hurts","Rest in a dark room and stay hydrated. If it persists, consult a doctor."
"flu, cold, sick","how to prevent flu, avoid getting sick","Wash your hands frequently, eat vitamins, and get plenty of sleep."
"diet, food, eat",what is a healthy diet,"A balanced diet includes fruits, vegetables, lean proteins, and whole grains."
"sleep, tired, rest","i am always tired, i can't sleep",Aim for 7-9 hours of sleep. Try to limit screen time 1 hour before bed.
"fever, hot, temperature","i have a fever, my body feels hot","Drink plenty of fluids and rest. Use a cool compress. If temperature is very high, see a doctor."
"stress, anxiety, worry",i feel stressed and anxious,"Try deep breathing exercises or a short walk. If you feel overwhelmed, talk to a professional."
"exercise, gym, workout",how often should i exercise,Most experts recommend at least 150 minutes of moderate aerobic activity per week.
"hate",i hate you,I'm sorry to hear that. I'm here to help you with your health questions. The rest is not my concern.